Association	According to the association rule, the most common prescribed pattern of 2-drug combination of CHM for treating @DISEASE@ was Ban-xia-xie-xin-tang plus @FORMULA@, while the 3-drug combination of CHM was Fang-feng-tong-sheng-san, Rheum palmatum and Ma-zi-ren-wan.
Association	According to the association rule, the most common prescribed pattern of 2-drug combination of CHM for treating @DISEASE@ was Ban-xia-xie-xin-tang plus Ma-zi-ren-wan, while the 3-drug combination of CHM was @FORMULA@, Rheum palmatum and Ma-zi-ren-wan.
Treatment of Disease	RESULT: @FORMULA@ reduce blood viscidity of the rats, reduce the @DISEASE@ of the murine, and promote the microcirculation of the uterus in rats.
Treatment of Disease	CONCLUSION: @FORMULA@ may prevent the development of @DISEASE@, perhaps by inhibiting the generation and release of the inflammatory response factors TNF-alpha, IL-1, IL-2, IL-6, and IL-8.
Treatment of Disease	These data revealed the therapeutic effect of @FORMULA@-treated rat serum on @DISEASE@.
Treatment of Disease	CONCLUSIONS: @FORMULA@ (SST or Xiao Chai Hu Tang) may improve @DISEASE@ in selected hepatitis C patients who are not candidates for interferon based treatment.
Association	CONCLUSIONS: @FORMULA@ (SST or Xiao Chai Hu Tang) may improve liver pathology in selected @DISEASE@ patients who are not candidates for interferon based treatment.
Treatment of Disease	CONCLUSION: Chinese herb medicine @FORMULA@ has neuroprotective effects on @DISEASE@ after focal cerebral ischemia in mice.
Association	CONCLUSION: Chinese herb medicine @FORMULA@ has neuroprotective effects on chronic brain injury after @DISEASE@ in mice.
Cause of Side-effect	We diagnosed that the administration of @FORMULA@ was the responsible medication because the @DISEASE@ developed immediately after drug ingestion and resolved after the cessation of such medication with no subsequent recurrence.
Treatment of Disease	The expression of ER-alpha mRNA, but not ER-beta mRNA was suppressed by @FORMULA@ or Shimotsu-to in an @DISEASE@ cell line.
Treatment of Disease	The expression of ER-alpha mRNA, but not ER-beta mRNA was suppressed by Juzen-taiho-to or @FORMULA@ in an @DISEASE@ cell line.
Treatment of Disease	The present study shows that @FORMULA@ has a therapeutic effect on @DISEASE@, in part, through down-regulation of KDM7A and Wnt/beta-catenin pathway.
Cause of Side-effect	Resuming @FORMULA@ without physician approval resulted in @DISEASE@ and after cessation the symptoms rapidly subsided.
Treatment of Disease	Taken together, it provides reliable experimental evidence and explains the molecular mechanism of @FORMULA@ for the treatment of patients with @DISEASE@.
Treatment of Disease	CONCLUSION: The pharmacokinetic behaviors of baicalin and wogonoside (especially the systemic exposure [AUCs] of baicalin and wogonoside) were significantly altered in @DISEASE@ rats after orally administrated @FORMULA@ extract.
Treatment of Disease	These findings indicated that other herbs in @FORMULA@ could have a protective effect against cinnabar- and realgar-induced @DISEASE@ and renal damage via modulating the disordered homeostasis of the glycerophospholipid, arachidonic acid, linoleic acid, ether lipid, and sphingolipid metabolism.
Treatment of Disease	These findings indicated that other herbs in @FORMULA@ could have a protective effect against cinnabar- and realgar-induced hepatic and @DISEASE@ via modulating the disordered homeostasis of the glycerophospholipid, arachidonic acid, linoleic acid, ether lipid, and sphingolipid metabolism.
Treatment of Disease	These findings indicated that other herbs in @FORMULA@ could have a protective effect against cinnabar- and realgar-induced hepatic and renal damage via modulating the @DISEASE@.
Treatment of Disease	Collectively, our findings demonstrated that @FORMULA@ mitigated @DISEASE@ in CKD rats which were associated with the restoration of dysbiosis of intestinal microbiota, implying its potential in clinical CKD treatment.
Treatment of Disease	Collectively, our findings demonstrated that @FORMULA@ mitigated kidney functional and structural impairment in CKD rats which were associated with the restoration of @DISEASE@ of intestinal microbiota, implying its potential in clinical CKD treatment.
Treatment of Disease	Collectively, our findings demonstrated that @FORMULA@ mitigated kidney functional and structural impairment in CKD rats which were associated with the restoration of dysbiosis of intestinal microbiota, implying its potential in clinical @DISEASE@ treatment.
Treatment of Disease	CONCLUSION: @FORMULA@ might promote Treg cell apoptosis in the @DISEASE@ microenvironment and further inhibit the tumor growth of 4T1 mouse breast cancer.
Treatment of Disease	CONCLUSION: @FORMULA@ might promote Treg cell apoptosis in the tumor microenvironment and further inhibit the tumor growth of 4T1 mouse @DISEASE@.
Treatment of Disease	Thus, the established method was sensitive enough and successfully applied to the determination of seven effective components in plasma taken from 24 high fat-induced @DISEASE@ rats after oral administration of three dosages of @FORMULA@.
Treatment of Disease	In conclusion, this study demonstrated that the Kampo prescriptions, consisting mainly of @FORMULA@, retarded the progression of @DISEASE@.
Treatment of Disease	CONCLUSIONS: @FORMULA@ can regulate the structure and function of the intestinal flora, alter expression levels of certain metabolic pathways, and has the potential to treat @DISEASE@.
Treatment of Disease	CONCLUSIONS: Purgation therapy with @FORMULA@ could reduce the stimulation of pathogenic factors on hepatocytes, protect the tissues and organs from @DISEASE@ caused by excessive inflammatory reaction.
Association	CONCLUSIONS: Purgation therapy with @FORMULA@ could reduce the stimulation of pathogenic factors on hepatocytes, protect the tissues and organs from injury caused by @DISEASE@ reaction.
Association	CONCLUSION: @FORMULA@ down-regulated the expressions of PDGFra, PDGFrb, PDGFb, PDGFd, COL1A1, COL1A2, COL5A2 and THBS1, and TGF-beta and PDGF signaling pathways in the DMN-induced @DISEASE@ in rats.
Treatment of Disease	CONCLUSION: The potential mechanisms and therapeutic effects of @FORMULA@ on @DISEASE@ may be attributed to the regulation of cardiac inflammation and fibrosis.
Treatment of Disease	CONCLUSION: The potential mechanisms and therapeutic effects of @FORMULA@ on hypertension may be attributed to the regulation of @DISEASE@ and fibrosis.
Treatment of Disease	CONCLUSION: The potential mechanisms and therapeutic effects of @FORMULA@ on hypertension may be attributed to the regulation of cardiac inflammation and @DISEASE@.
Treatment of Disease	In summary, @FORMULA@ may possess a beneficial effect on cardiac function by improving the @DISEASE@ microenvironment and by decreasing mitochondrial fission after MI.
Association	In summary, @FORMULA@ may possess a beneficial effect on cardiac function by improving the local ischemic microenvironment and by decreasing mitochondrial fission after @DISEASE@.
Treatment of Disease	RESULTS: We found that @FORMULA@ reduced @DISEASE@ size and weight, as well as significantly decreased cell viability both in vivo and in vitro.
Association	CONCLUSION: @FORMULA@ inhibited the expression of PD-L1 through multi-target and multi-pathway regulation of major oncogenes in @DISEASE@, thus effect cell proliferation and apoptosis.
Treatment of Disease	CONCLUSION: The pharmacological mechanisms of ingredients from @FORMULA@ on @DISEASE@ may be strongly associated with their modulatory effects on apoptosis, autophagy, cell cycle progression, and cell proliferation.
Treatment of Disease	These results suggest that @FORMULA@ has inhibitory effects on the development of @DISEASE@ formation in spontaneous FH model rabbits.
Association	These results suggest that @FORMULA@ has inhibitory effects on the development of atheromatous plaque formation in @DISEASE@ model rabbits.
Treatment of Disease	This paper reviews the mechanism of @FORMULA@ for the treatment of @DISEASE@.
Treatment of Disease	CONCLUSION: Early application of @FORMULA@ on the base of enteral nutritional therapy can lessen the degree of post-operational stress and @DISEASE@, and enhance the immune function of patients.
Treatment of Disease	CONCLUSIONS: @FORMULA@ can inhibit the formation of @DISEASE@ in HCC cells in vitro possibly by inhibiting the RhoA/ROCK pathways and the expressions of VE-cadherin and PI3K.
Association	CONCLUSIONS: @FORMULA@ can inhibit the formation of VM in @DISEASE@ cells in vitro possibly by inhibiting the RhoA/ROCK pathways and the expressions of VE-cadherin and PI3K.
Treatment of Disease	Taken together, it was demonstrated in this study that @FORMULA@ exerted a cardioprotective effect against pressure overload induced @DISEASE@ via inactivation of Tgf-beta/Smads and MAPKs signaling triggered fibrosis.
Treatment of Disease	Taken together, it was demonstrated in this study that @FORMULA@ exerted a cardioprotective effect against pressure overload induced cardiac remodeling via inactivation of Tgf-beta/Smads and MAPKs signaling triggered @DISEASE@.
Treatment of Disease	CONCLUSIONS: Our findings collectively suggest that @FORMULA@ has anti-inflammatory activity and antibacterial activity against H. pylori and could be an alternative to antibiotics for preventing @DISEASE@.
Treatment of Disease	This study unveils novel molecular mechanism by which @FORMULA@ controls @DISEASE@ cell growth.
Treatment of Disease	CONCLUSIONS: Results indicated that @FORMULA@ exerted a protective effect on CPZ-induced @DISEASE@.
Treatment of Disease	This study demonstrates that @FORMULA@ has preventive effects on LPS-induced @DISEASE@ by regulating inflammatory responses as an alternative for treating lung diseases.
Treatment of Disease	This study demonstrates that @FORMULA@ has preventive effects on LPS-induced ALI by regulating @DISEASE@ as an alternative for treating lung diseases.
Treatment of Disease	This study demonstrates that @FORMULA@ has preventive effects on LPS-induced ALI by regulating inflammatory responses as an alternative for treating @DISEASE@.
Treatment of Disease	@FORMULA@ increased the expression of aquaporin in the intestinal tract, reduced the water content of stool by promoting the absorption of water in the intestinal tract, inhibited the expression of aquaporin and its regulatory factors in nephridia tissue, and reduced the reabsorption of water to increase urine volume, to decrease the occurrence of @DISEASE@.
Treatment of Disease	CONCLUSION: @FORMULA@ enema and external use of Glauber's salt combined with routine non-operative conservative treatment can decrease the intra-abdominal pressure (IAP) of SAP patients and have preventive and therapeutic effects on @DISEASE@ of SAP.
Association	CONCLUSION: @FORMULA@ enema and external use of Glauber's salt combined with routine non-operative conservative treatment can decrease the intra-abdominal pressure (IAP) of SAP patients and have preventive and therapeutic effects on abdominal compartment syndrome of @DISEASE@.
Association	CONCLUSION: Matter by 70% ethanol with @FORMULA@ can intervene the ocurrence of the multi-drug resistance of @DISEASE@ cells by regulating the biology gene.
Treatment of Disease	The protective effect of @FORMULA@ against @DISEASE@ might be associated with MAPK/NF-small ka, CyrillicB pathway.
Cause of Side-effect	CONCLUSION: The @DISEASE@ of @FORMULA@ is correlated with the dose of A. manshriensis and the time of administration.
Treatment of Disease	This systematic review provided the evidences that TCM formulas combined with SSRIs might be helpful and safe in the treatment of @DISEASE@ of PD, including @FORMULA@.
Association	This systematic review provided the evidences that TCM formulas combined with SSRIs might be helpful and safe in the treatment of depression of @DISEASE@, including @FORMULA@.
Association	RESULTS: The content of MET in the @FORMULA@ group was significantly lower than that in the @DISEASE@ group (P < 0.01).
Treatment of Disease	CONCLUSION: The conclusion of this systematic review will provide evidence to judge whether @FORMULA@ is an effective therapeutic intervention for patient with @DISEASE@.
Treatment of Disease	These results provide direct evidence that @FORMULA@ can ameliorate @DISEASE@-like behaviors by inhibiting liver-brain inflammation axis.
Treatment of Disease	These results provide direct evidence that @FORMULA@ can ameliorate depressive-like behaviors by inhibiting @DISEASE@ axis.
Treatment of Disease	In this paper, we critically review the clinical data available (to date) in order to assess the efficacy of @FORMULA@ in inducing ovulation in several types of @DISEASE@.
Treatment of Disease	CONCLUSIONS @FORMULA@ is able to regulate glycometabolism-related, lipid metabolism-related, @DISEASE@-related, oxidative stress-related signaling pathways, and biological processes and targets, which suggests that SMP may have a therapeutic effect on DCM.
Treatment of Disease	CONCLUSIONS SMP is able to regulate glycometabolism-related, lipid metabolism-related, inflammatory response-related, oxidative stress-related signaling pathways, and biological processes and targets, which suggests that @FORMULA@ may have a therapeutic effect on @DISEASE@.
Treatment of Disease	@FORMULA@ could be a potent inhibitor in the pathogenesis of @DISEASE@.
Treatment of Disease	This review discusses the properties of @FORMULA@ with regards to the treatment of @DISEASE@ and suggests the side effects of Sho-saiko-to.
Treatment of Disease	CONCLUSION: The effect of @FORMULA@ in treating @DISEASE@ was probably associated with its improvement of PI-3K p85 mRNA and protein expressions in skeletal muscle and adipose tissue of the T2DM rats.
Association	CONCLUSION: These data suggest that severe NV in @DISEASE@ is inhibited by @FORMULA@ treatment.
Treatment of Disease	CONCLUSION: These data suggest that @DISEASE@ in OIR is inhibited by @FORMULA@ treatment.
Treatment of Disease	CONCLUSIONS: The findings of the present study provide evidence that @FORMULA@ may serve as a novel target for potential therapeutic treatment of @DISEASE@.
Association	Medical practitioners prescribing @FORMULA@ should take into account the association between licorice, which is its main ingredient, and @DISEASE@.
Treatment of Disease	[Antipyretic effect of active components of @FORMULA@ and its correlation with pharmacokinetics in @DISEASE@ rats].
Association	It was speculated that the progression of interstitial pneumonia in the present case may have been caused by @DISEASE@ in combination with @FORMULA@-induced lung injury.
Cause of Side-effect	It was speculated that the progression of interstitial pneumonia in the present case may have been caused by HCV in combination with @FORMULA@-induced @DISEASE@.
Cause of Side-effect	It was speculated that the progression of @DISEASE@ in the present case may have been caused by HCV in combination with @FORMULA@-induced lung injury.
Treatment of Disease	Based on our study, @FORMULA@ could be useful in the management of @DISEASE@ as chemoprevention and chemotherapy remedy.
Treatment of Disease	Therefore, a new reliable method for rapidly recognizing and optimizing the effective constituents of @FORMULA@ treating @DISEASE@ was established.
Cause of Side-effect	Patients 2 was though to have a typical case of @FORMULA@-induced @DISEASE@, patient 1 was thought to have fulminating variant of this disease.
Treatment of Disease	Clinical effects of @FORMULA@ in the treatment of @DISEASE@: a systematic review and meta-analysis.
Treatment of Disease	Together, these results suggest that @FORMULA@ contains effective constituents and alleviates @DISEASE@ with LDSDS by regulating AMPA-type glutamate receptor homeostasis in amygdala and hippocampus.
Treatment of Disease	CONCLUSIONS: @FORMULA@ alleviated the symptoms of @DISEASE@ by upregulating the production of ghrelin, CCK and VIP and by increasing the levels of these neuropeptides in circulation.
Treatment of Disease	Therapeutic effect of @FORMULA@ on @DISEASE@ via upregulation of aquaporin1 and aquaporin5 expression levels.
Treatment of Disease	Therefore, @FORMULA@ is a potential candidate for the treatment of @DISEASE@.
Treatment of Disease	CONCLUSIONS: Our findings indicated that @FORMULA@ protected ovarian function of Cy-induced @DISEASE@ mice by improving the antioxidant ability and promoting ovarian angiogenesis, thereby providing scientific evidence for the treatment of POF using SWT.
Treatment of Disease	CONCLUSION: The methodological quality of included trials may limit the conclusions that indicate that modified @FORMULA@ may have a promising treatment for improving FEV1/FVC and MVV, increasing exercise endurance and life quality scores on @DISEASE@ patients.
Treatment of Disease	The bioactive constituents of @FORMULA@ for inhibiting ADP-induced @DISEASE@ and thrombin activity include aromatic acids, glycosides and phthalides.
Treatment of Disease	CONCLUSION: @FORMULA@ could effectively inhibit Iso induced @DISEASE@, and its mechanism may be associated with down-regulating the expression of Smad2 and up-regulating the expression of Smad7.
Treatment of Disease	In conclusion, it was supposed that @FORMULA@ might be a potential Chinese medicine decoction for treating or alleviating complex symptoms of @DISEASE@ through BDNF-TrkB-CREB pathway.
Treatment of Disease	XYXD treatment ameliorated intestinal inflammation, cell death, and tight junction disintegrity induced by CCl4 treatment, suggesting that @FORMULA@ inhibits CCl4-mediated @DISEASE@ at least in part by ameliorating the intestinal epithelial damage.
Treatment of Disease	XYXD treatment ameliorated intestinal inflammation, cell death, and tight junction disintegrity induced by CCl4 treatment, suggesting that @FORMULA@ inhibits CCl4-mediated liver fibrosis at least in part by ameliorating the @DISEASE@.
Treatment of Disease	@FORMULA@ treatment ameliorated @DISEASE@, cell death, and tight junction disintegrity induced by CCl4 treatment, suggesting that XYXD inhibits CCl4-mediated liver fibrosis at least in part by ameliorating the intestinal epithelial damage.
Treatment of Disease	CONCLUSIONS: Treatment with @FORMULA@ improves MCD diet-induced @DISEASE@ in part via blocking TLR4-JNK and Caspase-8-GSDMD signaling pathways, suggesting that Si-Wu-Tang has potential for clinical application in treating NAFLD.
Treatment of Disease	CONCLUSION: If the increasing of the spontaneous activities of ICx and AII in chronic tinnitus rats means @DISEASE@, the use of @FORMULA@ could decrease this kind of changes.
Treatment of Disease	CONCLUSION: @FORMULA@ might postpone colonic epithelium apoptosis or improve inflammatory cell apoptosis by regulating the expression of Fas/ FasL and Bax/Bcl-2 mRNA in colonic tissue, which is possible potential path to effectively treat experimental @DISEASE@ by enema.
Treatment of Disease	Canonical correlation analysis between the SND-induced and SND-related metabolites revealed that 12 compounds had strongly correlated relationship with the protective effect of @FORMULA@ on @DISEASE@, and these compounds include isotalatizidine, songorine, fuziline, neoline, talatizamine, 14-acetyltalatizamine, liquiritigenin, benzoylmesaconitine, isoliquiritin, benzoylaconitne, benzoylhypaconitine and 6-gingerol.
Treatment of Disease	The PPI network and KEGG pathway analysis results showed that @FORMULA@ affects @DISEASE@ mainly through modulating pathways related to viral infection, immunity, cancer, signal transduction, and metabolism.
Association	The PPI network and KEGG pathway analysis results showed that @FORMULA@ affects HB mainly through modulating pathways related to @DISEASE@, immunity, cancer, signal transduction, and metabolism.
Association	The PPI network and KEGG pathway analysis results showed that @FORMULA@ affects HB mainly through modulating pathways related to viral infection, immunity, @DISEASE@, signal transduction, and metabolism.
Treatment of Disease	It merely showed that @FORMULA@ could alleviate the severity of @DISEASE@ and qi deficiency in patients with CFS.
Association	It merely showed that @FORMULA@ could alleviate the severity of fatigue and qi deficiency in patients with @DISEASE@.
Treatment of Disease	CONCLUSIONS: The therapeutic effect of @FORMULA@ on FD is at least partially through improvement of TJ integrity and attenuation of FD-associated @DISEASE@.
Treatment of Disease	CONCLUSIONS: The therapeutic effect of @FORMULA@ on @DISEASE@ is at least partially through improvement of TJ integrity and attenuation of FD-associated low-grade inflammation in the duodenum.
Treatment of Disease	The present study suggests that @FORMULA@ essential oil may have potential as a therapeutic inhalation drug for the prevention and treatment of @DISEASE@.
Treatment of Disease	@FORMULA@ exhibited protective effects against colon damage by inhibiting the @DISEASE@.
Treatment of Disease	@FORMULA@ exhibited protective effects against @DISEASE@ by inhibiting the inflammatory response.
Association	[Immunologic examination of @FORMULA@ (TJ-48) in @DISEASE@].
Treatment of Disease	These results suggest that @FORMULA@ has protective effect against NO-mediated @DISEASE@ in cultured CGCs and that it is derived from Cinnamomi Cortex, Paeoniae Radix and Moutan Cortex.
Treatment of Disease	Also in the @FORMULA@ treated group, NeuN-positive cells were increased and number of astrocytes, microglia, and apoptotic cells was significantly decreased compared with the control group in the @DISEASE@ peri-infarct area.
Treatment of Disease	Also in the @FORMULA@ treated group, NeuN-positive cells were increased and number of astrocytes, microglia, and apoptotic cells was significantly decreased compared with the control group in the ischemic peri-@DISEASE@ area.
Negative	CONCLUSIONS: We demonstrated that @FORMULA@ can attenuate airway hyperresponsiveness induced by ozone without affecting @DISEASE@, which suggests that Bakumondo-to may act on the subsequent mechanisms after the induction of inflammation, such as mediator release.
Treatment of Disease	CONCLUSIONS: We demonstrated that @FORMULA@ can attenuate @DISEASE@ induced by ozone without affecting airway inflammation, which suggests that Bakumondo-to may act on the subsequent mechanisms after the induction of inflammation, such as mediator release.
Association	In conclusion, @FORMULA@ can ameliorate inflammation in DSS-induced @DISEASE@ rats.
Treatment of Disease	In conclusion, @FORMULA@ can ameliorate @DISEASE@ in DSS-induced UC rats.
Treatment of Disease	CONCLUSION: We are the first to elucidate that @FORMULA@ inhibits the @DISEASE@ induced by ischemic retinopathy in OIR mice.
Association	CONCLUSION: We are the first to elucidate that @FORMULA@ inhibits the retinal pathogenic angiogenesis induced by @DISEASE@ in OIR mice.
Treatment of Disease	In vivo, @FORMULA@ significantly inhibited insulitis, delayed the onset and development of @DISEASE@, promoted insulin secretion and sensitivity, and balanced partially normalized Th1 and Th2 cytokines in NOD mice.
Association	CONCLUSIONS: Owing to insufficient clinical data, it is difficult to draw a definite conclusion regarding the effectiveness and safety of @FORMULA@ for @DISEASE@, and better trials are needed.
Cause of Side-effect	Based on these findings, the diagnosis of pneumonitis and @DISEASE@ induced by @FORMULA@ was established.
Cause of Side-effect	Based on these findings, the diagnosis of @DISEASE@ and hepatic injury induced by @FORMULA@ was established.
Treatment of Disease	We can conclude that @FORMULA@ has the therapeutic effect on @DISEASE@.
Treatment of Disease	Taken together, we demonstrated that @FORMULA@ may prevent @DISEASE@ via reversing the imbalance of bone fomation/bone resorption and activating the TGF-beta-Smad signal.
Treatment of Disease	Taken together, we demonstrated that @FORMULA@ may prevent osteoporosis via reversing the @DISEASE@ and activating the TGF-beta-Smad signal.
Treatment of Disease	Overall, our study highlighted the effect of @FORMULA@ on the @DISEASE@ in the FD rats, providing new insight into the mechanism of SBS treatment for FD from the perspective of metabolomics.
Treatment of Disease	Overall, our study highlighted the effect of SBS on the disturbed metabolic pathways in the FD rats, providing new insight into the mechanism of @FORMULA@ treatment for @DISEASE@ from the perspective of metabolomics.
Treatment of Disease	CONCLUSION: Stigmasterol as the one of the main compounds of @FORMULA@ suppresses @DISEASE@ cell activities through the PI3K-Akt signaling pathway.
Treatment of Disease	@FORMULA@ acutely improves CBF in eNOS-dependent vasodilation and reduces @DISEASE@ size in focal cerebral ischemia.
Treatment of Disease	@FORMULA@ acutely improves CBF in eNOS-dependent vasodilation and reduces infarct size in @DISEASE@.
Treatment of Disease	CONCLUSION: The effects of Fluticasone inhalation combined with @FORMULA@ on pulmonary function and serum IL-16 levels were superior to those of Fluticasone inhalation and XQLD alone in @DISEASE@ patients.
Treatment of Disease	Inhibition by @FORMULA@ (TJ-9) of development of @DISEASE@ induced by N-nitrosomorpholine in Sprague-Dawley rats.
Treatment of Disease	CONCLUSION: Our findings provided evidence that @FORMULA@ is a therapeutic option to treat @DISEASE@ effectively and safely.
Treatment of Disease	Acute oral toxicity of @FORMULA@, a traditional herbal formula, in rats and its protective effects against ovalbumin-induced @DISEASE@ via anti-inflammatory and antioxidant properties.
